{
  "success": true,
  "mqtt_broker": "mqtt.example.com",
  "mqtt_port": 8883,
  "mqtt_username": "device-7e570000-0000-4000-8000-0000000000d1",
  "mqtt_password": "TEST-ONLY-mqtt-password-0123456789abcdef",
  "tenant_id": "7e570000-0000-4000-8000-000000000001",
  "device_code": "RPI-7E57C0DE",
  "mqtt_tls_enabled": true
}
